[
  {
    "id": "a3-001",
    "name": "Exeggcute",
    "set_code": "a3",
    "type": "Pokémon",
    "subtype": "Grass",
    "stage": "Basic",
    "health": 60,
    "retreat": 1,
    "weakness": "Fire",
    "ability": {
      "exists": false,
      "name": null,
      "effect": null
    },
    "attacks": {
      "1": {
        "cost": "GC",
        "name": "Rolling Tackle",
        "damage": 30,
        "effect": null
      },
      "2": {
        "cost": null,
        "name": null,
        "damage": null,
        "effect": null
      }
    },
    "points": 1,
    "ex": false,
    "mega": false,
    "deckBuilderNr": 582,
    "image": "https://raw.githubusercontent.com/PocketDecks/pokemon-tcg-pocket-cards/refs/heads/main/images/webp/cards/a3/001.webp"
  },
  {
    "id": "a3-002",
    "name": "Alolan Exeggutor",
    "set_code": "a3",
    "type": "Pokémon",
    "subtype": "Grass",
    "stage": "Stage 1",
    "evolves_from": "Exeggcute",
    "health": 150,
    "retreat": 4,
    "weakness": "Fire",
    "ability": {
      "exists": false,
      "name": null,
      "effect": null
    },
    "attacks": {
      "1": {
        "cost": "GCC",
        "name": "Tropical Hammer",
        "damage": 150,
        "effect": "Flip a coin. If tails, this attack does nothing."
      },
      "2": {
        "cost": null,
        "name": null,
        "damage": null,
        "effect": null
      }
    },
    "points": 1,
    "ex": false,
    "mega": false,
    "deckBuilderNr": 583,
    "image": "https://raw.githubusercontent.com/PocketDecks/pokemon-tcg-pocket-cards/refs/heads/main/images/webp/cards/a3/002.webp"
  },
  {
    "id": "a3-003",
    "name": "Surskit",
    "set_code": "a3",
    "type": "Pokémon",
    "subtype": "Grass",
    "stage": "Basic",
    "health": 50,
    "retreat": 1,
    "weakness": "Fire",
    "ability": {
      "exists": false,
      "name": null,
      "effect": null
    },
    "attacks": {
      "1": {
        "cost": "C",
        "name": "Quick Attack",
        "damage": 10,
        "effect": "Flip a coin. If heads, this attack does 20 more damage."
      },
      "2": {
        "cost": null,
        "name": null,
        "damage": null,
        "effect": null
      }
    },
    "points": 1,
    "ex": false,
    "mega": false,
    "deckBuilderNr": 584,
    "image": "https://raw.githubusercontent.com/PocketDecks/pokemon-tcg-pocket-cards/refs/heads/main/images/webp/cards/a3/003.webp"
  },
  {
    "id": "a3-004",
    "name": "Masquerain",
    "set_code": "a3",
    "type": "Pokémon",
    "subtype": "Grass",
    "stage": "Stage 1",
    "evolves_from": "Surskit",
    "health": 90,
    "retreat": 0,
    "weakness": "Fire",
    "ability": {
      "exists": false,
      "name": null,
      "effect": null
    },
    "attacks": {
      "1": {
        "cost": "G",
        "name": "Bug Buzz",
        "damage": 40,
        "effect": null
      },
      "2": {
        "cost": null,
        "name": null,
        "damage": null,
        "effect": null
      }
    },
    "points": 1,
    "ex": false,
    "mega": false,
    "deckBuilderNr": 585,
    "image": "https://raw.githubusercontent.com/PocketDecks/pokemon-tcg-pocket-cards/refs/heads/main/images/webp/cards/a3/004.webp"
  },
  {
    "id": "a3-005",
    "name": "Maractus",
    "set_code": "a3",
    "type": "Pokémon",
    "subtype": "Grass",
    "stage": "Basic",
    "health": 90,
    "retreat": 1,
    "weakness": "Fire",
    "ability": {
      "exists": false,
      "name": null,
      "effect": null
    },
    "attacks": {
      "1": {
        "cost": "GC",
        "name": "Sting",
        "damage": 40,
        "effect": null
      },
      "2": {
        "cost": null,
        "name": null,
        "damage": null,
        "effect": null
      }
    },
    "points": 1,
    "ex": false,
    "mega": false,
    "deckBuilderNr": 586,
    "image": "https://raw.githubusercontent.com/PocketDecks/pokemon-tcg-pocket-cards/refs/heads/main/images/webp/cards/a3/005.webp"
  },
  {
    "id": "a3-006",
    "name": "Karrablast",
    "set_code": "a3",
    "type": "Pokémon",
    "subtype": "Grass",
    "stage": "Basic",
    "health": 60,
    "retreat": 1,
    "weakness": "Fire",
    "ability": {
      "exists": false,
      "name": null,
      "effect": null
    },
    "attacks": {
      "1": {
        "cost": "C",
        "name": "Headbutt",
        "damage": 10,
        "effect": null
      },
      "2": {
        "cost": null,
        "name": null,
        "damage": null,
        "effect": null
      }
    },
    "points": 1,
    "ex": false,
    "mega": false,
    "deckBuilderNr": 587,
    "image": "https://raw.githubusercontent.com/PocketDecks/pokemon-tcg-pocket-cards/refs/heads/main/images/webp/cards/a3/006.webp"
  },
  {
    "id": "a3-007",
    "name": "Phantump",
    "set_code": "a3",
    "type": "Pokémon",
    "subtype": "Grass",
    "stage": "Basic",
    "health": 60,
    "retreat": 1,
    "weakness": "Fire",
    "ability": {
      "exists": false,
      "name": null,
      "effect": null
    },
    "attacks": {
      "1": {
        "cost": "G",
        "name": "Hook",
        "damage": 20,
        "effect": null
      },
      "2": {
        "cost": null,
        "name": null,
        "damage": null,
        "effect": null
      }
    },
    "points": 1,
    "ex": false,
    "mega": false,
    "deckBuilderNr": 588,
    "image": "https://raw.githubusercontent.com/PocketDecks/pokemon-tcg-pocket-cards/refs/heads/main/images/webp/cards/a3/007.webp"
  },
  {
    "id": "a3-008",
    "name": "Trevenant",
    "set_code": "a3",
    "type": "Pokémon",
    "subtype": "Grass",
    "stage": "Stage 1",
    "evolves_from": "Phantump",
    "health": 130,
    "retreat": 3,
    "weakness": "Fire",
    "ability": {
      "exists": false,
      "name": null,
      "effect": null
    },
    "attacks": {
      "1": {
        "cost": "GGC",
        "name": "Claw Slash",
        "damage": 80,
        "effect": null
      },
      "2": {
        "cost": null,
        "name": null,
        "damage": null,
        "effect": null
      }
    },
    "points": 1,
    "ex": false,
    "mega": false,
    "deckBuilderNr": 589,
    "image": "https://raw.githubusercontent.com/PocketDecks/pokemon-tcg-pocket-cards/refs/heads/main/images/webp/cards/a3/008.webp"
  },
  {
    "id": "a3-009",
    "name": "Rowlet",
    "set_code": "a3",
    "type": "Pokémon",
    "subtype": "Grass",
    "stage": "Basic",
    "health": 60,
    "retreat": 1,
    "weakness": "Fire",
    "ability": {
      "exists": false,
      "name": null,
      "effect": null
    },
    "attacks": {
      "1": {
        "cost": "G",
        "name": "Leafage",
        "damage": 20,
        "effect": null
      },
      "2": {
        "cost": null,
        "name": null,
        "damage": null,
        "effect": null
      }
    },
    "points": 1,
    "ex": false,
    "mega": false,
    "deckBuilderNr": 590,
    "image": "https://raw.githubusercontent.com/PocketDecks/pokemon-tcg-pocket-cards/refs/heads/main/images/webp/cards/a3/009.webp"
  },
  {
    "id": "a3-010",
    "name": "Rowlet",
    "set_code": "a3",
    "type": "Pokémon",
    "subtype": "Grass",
    "stage": "Basic",
    "health": 60,
    "retreat": 1,
    "weakness": "Fire",
    "ability": {
      "exists": false,
      "name": null,
      "effect": null
    },
    "attacks": {
      "1": {
        "cost": "G",
        "name": "Skill Dive",
        "damage": null,
        "effect": "This attack does 10 damage to 1 of your opponent's Pokémon."
      },
      "2": {
        "cost": null,
        "name": null,
        "damage": null,
        "effect": null
      }
    },
    "points": 1,
    "ex": false,
    "mega": false,
    "deckBuilderNr": 591,
    "image": "https://raw.githubusercontent.com/PocketDecks/pokemon-tcg-pocket-cards/refs/heads/main/images/webp/cards/a3/010.webp"
  },
  {
    "id": "a3-011",
    "name": "Dartrix",
    "set_code": "a3",
    "type": "Pokémon",
    "subtype": "Grass",
    "stage": "Stage 1",
    "evolves_from": "Rowlet",
    "health": 80,
    "retreat": 1,
    "weakness": "Fire",
    "ability": {
      "exists": false,
      "name": null,
      "effect": null
    },
    "attacks": {
      "1": {
        "cost": "G",
        "name": "Razor Wing",
        "damage": 30,
        "effect": null
      },
      "2": {
        "cost": null,
        "name": null,
        "damage": null,
        "effect": null
      }
    },
    "points": 1,
    "ex": false,
    "mega": false,
    "deckBuilderNr": 592,
    "image": "https://raw.githubusercontent.com/PocketDecks/pokemon-tcg-pocket-cards/refs/heads/main/images/webp/cards/a3/011.webp"
  },
  {
    "id": "a3-012",
    "name": "Decidueye ex",
    "set_code": "a3",
    "type": "Pokémon",
    "subtype": "Grass",
    "stage": "Stage 2",
    "evolves_from": "Dartrix",
    "health": 170,
    "retreat": 1,
    "weakness": "Fire",
    "ability": {
      "exists": false,
      "name": null,
      "effect": null
    },
    "attacks": {
      "1": {
        "cost": "CC",
        "name": "Pierce the Pain",
        "damage": null,
        "effect": "This attack does 100 damage to 1 of your opponent's Pokémon that have damage on them."
      },
      "2": {
        "cost": "GG",
        "name": "Razor Leaf",
        "damage": 80,
        "effect": null
      }
    },
    "points": 2,
    "ex": true,
    "mega": false,
    "deckBuilderNr": 593,
    "image": "https://raw.githubusercontent.com/PocketDecks/pokemon-tcg-pocket-cards/refs/heads/main/images/webp/cards/a3/012.webp"
  },
  {
    "id": "a3-013",
    "name": "Grubbin",
    "set_code": "a3",
    "type": "Pokémon",
    "subtype": "Grass",
    "stage": "Basic",
    "health": 60,
    "retreat": 1,
    "weakness": "Fire",
    "ability": {
      "exists": false,
      "name": null,
      "effect": null
    },
    "attacks": {
      "1": {
        "cost": "C",
        "name": "Gnaw",
        "damage": 10,
        "effect": null
      },
      "2": {
        "cost": null,
        "name": null,